{
  "idempotencyKey": "commit:model-seal:1",
  "invocationId": "invocation:1",
  "expectedNextSequence": 1,
  "revisions": [
    {
      "kind": "application",
      "id": "application:web",
      "revision": "sha256:1111111111111111111111111111111111111111111111111111111111111111",
      "schemaVersion": 1,
      "payload": {
        "name": "web"
      }
    },
    {
      "kind": "applicationModel",
      "id": "model:workspace",
      "revision": "sha256:2222222222222222222222222222222222222222222222222222222222222222",
      "schemaVersion": 1,
      "payload": {
        "application": "application:web"
      }
    }
  ],
  "events": [
    {
      "schemaVersion": 1,
      "eventId": "event:1",
      "eventType": "ApplicationModelConstructed",
      "occurredAt": "2026-07-18T20:00:00.000Z",
      "invocationId": "invocation:1",
      "subject": {
        "kind": "applicationModel",
        "id": "model:workspace",
        "revision": "sha256:2222222222222222222222222222222222222222222222222222222222222222",
        "schemaVersion": 1
      },
      "correlationId": "operation:1",
      "sequence": 1,
      "producer": {
        "id": "engine",
        "version": "0.0.0",
        "artifactDigest": "sha256:aaaaaaaaaaaaaaaaaaaaaaaaaaaaaaaaaaaaaaaaaaaaaaaaaaaaaaaaaaaaaaaa"
      },
      "dataClassification": "MINIMAL_METADATA",
      "payload": {
        "applicationCount": 1
      }
    },
    {
      "schemaVersion": 1,
      "eventId": "event:2",
      "eventType": "ApplicationModelSealed",
      "occurredAt": "2026-07-18T20:00:00.001Z",
      "invocationId": "invocation:1",
      "subject": {
        "kind": "applicationModel",
        "id": "model:workspace",
        "revision": "sha256:2222222222222222222222222222222222222222222222222222222222222222",
        "schemaVersion": 1
      },
      "causationId": "event:1",
      "correlationId": "operation:1",
      "sequence": 2,
      "producer": {
        "id": "engine",
        "version": "0.0.0",
        "artifactDigest": "sha256:aaaaaaaaaaaaaaaaaaaaaaaaaaaaaaaaaaaaaaaaaaaaaaaaaaaaaaaaaaaaaaaa"
      },
      "dataClassification": "MINIMAL_METADATA",
      "payload": {
        "sealed": true
      }
    }
  ],
  "referenceEdges": [
    {
      "source": {
        "kind": "applicationModel",
        "id": "model:workspace",
        "revision": "sha256:2222222222222222222222222222222222222222222222222222222222222222",
        "schemaVersion": 1
      },
      "relation": "contains",
      "target": {
        "kind": "application",
        "id": "application:web",
        "revision": "sha256:1111111111111111111111111111111111111111111111111111111111111111",
        "schemaVersion": 1
      }
    }
  ],
  "currentRevisionMutations": [
    {
      "slot": "workspace:current-model",
      "expectedCurrent": null,
      "nextCurrent": {
        "kind": "applicationModel",
        "id": "model:workspace",
        "revision": "sha256:2222222222222222222222222222222222222222222222222222222222222222",
        "schemaVersion": 1
      }
    }
  ]
}
